{
  "$schema": "kh-sim-golden-vector-v1",
  "metadata": {
    "vector_id": "V5-half-resolution-fast",
    "purpose": "Half-resolution fast. Same T_end as V1; 1/4 spatial points; fast CI unit-test.",
    "generation_date": "2026-05-15T08:02:14Z",
    "oracle_commit": "65acf105176fadf96e0cd52d39ca3ff0573f2ada",
    "oracle_path": "shared/physics/kh_physics.py",
    "scheme": "RK4 (canonical)",
    "dealiasing": "2/3-rule (Orszag 1971; KH-NM-4)",
    "cfl_guard": "advective+diffusive bound (KH-NM-5)",
    "environment": {
      "python": "3.13.13",
      "numpy": "2.4.4",
      "scipy": "1.17.1"
    }
  },
  "parameters": {
    "grid_nx": 32,
    "grid_ny": 16,
    "domain_lx": 1.0,
    "domain_ly": 0.5,
    "dt": 0.0005,
    "nsteps": 200,
    "reynolds_number": 1000.0,
    "velocity_shear": 1.0,
    "perturbation_amplitude": 0.01,
    "perturbation_mode": 2
  },
  "diagnostics": {
    "kinetic_energy": 0.11643744584352617,
    "enstrophy": 46.22148587424567,
    "max_vorticity": 33.05708190311373,
    "divergence_rms": 4.437829751884882e-15,
    "cfl_peak": 0.01241626240152923,
    "t_final": 0.1
  },
  "field_summaries": {
    "u_velocity": {
      "length": 512,
      "first_10": [
        -1.036341621887971e-18,
        0.12686878244538036,
        0.25149645425816525,
        0.38221333412155295,
        0.501869256837124,
        0.6378165694607136,
        0.7283716498621816,
        0.6744701217017929,
        7.789367176581377e-18,
        -0.6744701217017929
      ],
      "last_10": [
        0.7311073541149651,
        0.6729855483732301,
        -0.005323731589743631,
        -0.675792906897411,
        -0.7252717828758262,
        -0.6360576649675913,
        -0.5015633542243328,
        -0.38166749242144804,
        -0.2519293419344326,
        -0.12765801772963253
      ],
      "min": -0.7339484228778297,
      "max": 0.7339484228778297,
      "mean": 0.0
    },
    "v_velocity": {
      "length": 512,
      "first_10": [
        6.07979822952139e-19,
        -0.00044175397197241057,
        -0.0012224331820532514,
        -0.0010914712849823102,
        -0.0006323846959707156,
        0.0001233305230586261,
        0.0027781077377786656,
        0.004001063445641417,
        3.0530546362557343e-19,
        -0.004001063445641407
      ],
      "last_10": [
        -0.0015746508334231134,
        -0.000711506105821693,
        -0.004473809550646751,
        -0.008098887445595433,
        -0.006698470926412585,
        -0.0039051845607052296,
        -0.0030772655441360488,
        -0.0026542545553941465,
        -0.0024985281768020247,
        -0.0032375496716330046
      ],
      "min": -0.012133064464679457,
      "max": 0.012133064464679448,
      "mean": 0.0
    },
    "vorticity": {
      "length": 512,
      "first_10": [
        0.09566744422474938,
        0.16540936550029445,
        0.0393290726334782,
        0.21722804479861008,
        -0.00064099606575201,
        0.3768767267369228,
        1.859650853345129,
        14.1607536930662,
        33.05708190311373,
        14.160753693066201
      ],
      "last_10": [
        1.9010818175248232,
        14.362547948897257,
        33.04364874595204,
        13.929503762977218,
        1.7947581024309007,
        0.44921052233268227,
        -0.0051283868565869814,
        0.22075266402929036,
        0.0746016056523229,
        0.14052555600871802
      ],
      "min": -0.21698464899620723,
      "max": 33.05708190311373,
      "mean": 4.047074015288665
    },
    "pressure": {
      "length": 512,
      "first_10": [
        -0.039994903141478,
        -0.03800762295298081,
        -0.032105277158677704,
        -0.02218962283083331,
        -0.008392974905163136,
        0.009442428535286464,
        0.030900342192564923,
        0.0538023651613808,
        0.0659892184225516,
        0.0538023651613808
      ],
      "last_10": [
        0.030919429460519985,
        0.05385444061992529,
        0.06591837200424948,
        0.05361081224066236,
        0.030750327259436147,
        0.00937865503515672,
        -0.008431670842142866,
        -0.022214357290343184,
        -0.032125480943010154,
        -0.038051875152633426
      ],
      "min": -0.04152927703120519,
      "max": 0.0659892184225516,
      "mean": -1.6263032587282567e-19
    }
  },
  "tolerances": {
    "scalar_abs": 1e-12,
    "scalar_rel": 1e-09,
    "scalar_div_rms_abs": 1e-11,
    "scalar_div_rms_rel": 1e-08,
    "field_summary_abs": 1e-10,
    "field_summary_rel": 1e-07,
    "field_element_abs": 1e-09,
    "field_element_rel": 1e-07,
    "sqrt_n_scaling": true,
    "backend_overrides": {
      "kh-scala": {
        "scalar_factor": 2.0,
        "field_factor": 2.0
      },
      "kh-pascal": {
        "scalar_factor": 10.0,
        "field_factor": 10.0
      }
    }
  }
}